{
  "metadata": {
    "schemaVersion": "2",
    "generatedAt": "2026-01-01T00:05:00Z",
    "sourceHealth": "healthy",
    "nodeName": "worker-a"
  },
  "database": {
    "logicalRouters": [
      {
        "uuid": "lr-cluster",
        "name": "cluster-router",
        "ports": [
          "lrp-cluster-to-red"
        ],
        "nat": [
          "nat-red-snat"
        ],
        "staticRoutes": [
          "sr-default"
        ],
        "externalIds": {
          "k8s.ovn.org/topology": "layer3"
        }
      }
    ],
    "logicalRouterPorts": [
      {
        "uuid": "lrp-cluster-to-red",
        "name": "rtos-red-net",
        "mac": "0a:58:0a:f4:00:01",
        "networks": [
          "10.244.0.1/24"
        ]
      }
    ],
    "logicalSwitches": [
      {
        "uuid": "ls-red",
        "name": "red-net",
        "ports": [
          "lsp-red-a",
          "lsp-red-to-cluster"
        ],
        "otherConfig": {
          "subnet": "10.244.0.0/24"
        },
        "externalIds": {
          "k8s.ovn.org/network": "red"
        }
      }
    ],
    "logicalSwitchPorts": [
      {
        "uuid": "lsp-red-a",
        "name": "red_pod-a",
        "addresses": [
          "0a:58:0a:f4:00:05 10.244.0.5"
        ],
        "externalIds": {
          "namespace": "red",
          "pod": "true"
        }
      },
      {
        "uuid": "lsp-red-to-cluster",
        "name": "stor-red-net",
        "type": "router",
        "addresses": [
          "router"
        ],
        "options": {
          "router-port": "rtos-red-net"
        }
      }
    ],
    "nats": [
      {
        "uuid": "nat-red-snat",
        "type": "snat",
        "externalIp": "192.168.1.11",
        "logicalIp": "10.244.0.0/24"
      }
    ],
    "staticRoutes": [
      {
        "uuid": "sr-default",
        "ipPrefix": "0.0.0.0/0",
        "nexthop": "100.64.0.1"
      }
    ]
  },
  "nodes": [
    {
      "id": "lr-cluster",
      "kind": "logical_router",
      "label": "cluster-router"
    },
    {
      "id": "ls-red",
      "kind": "logical_switch",
      "label": "red-net"
    },
    {
      "id": "lsp-red-a",
      "kind": "logical_switch_port",
      "label": "pod-a"
    }
  ],
  "edges": [
    {
      "id": "e1",
      "source": "lr-cluster",
      "target": "ls-red",
      "kind": "router_to_switch"
    },
    {
      "id": "e2",
      "source": "ls-red",
      "target": "lsp-red-a",
      "kind": "switch_to_port"
    }
  ],
  "groups": [
    {
      "id": "g-red",
      "label": "Namespace red",
      "nodeIds": [
        "ls-red",
        "lsp-red-a"
      ]
    }
  ],
  "warnings": []
}
