{
  "metadata": {
    "schemaVersion": "2",
    "generatedAt": "2026-01-01T00:10:00Z",
    "sourceHealth": "healthy",
    "nodeName": "worker-dense"
  },
  "database": {
    "logicalRouters": [
      {
        "uuid": "lr-core",
        "name": "core",
        "ports": [
          "lrp-core-a",
          "lrp-core-b",
          "lrp-core-c"
        ]
      }
    ],
    "logicalRouterPorts": [
      {
        "uuid": "lrp-core-a",
        "name": "rtos-net-a",
        "mac": "0a:58:0a:f4:00:01",
        "networks": [
          "10.244.0.1/24"
        ]
      },
      {
        "uuid": "lrp-core-b",
        "name": "rtos-net-b",
        "mac": "0a:58:0a:f4:01:01",
        "networks": [
          "10.244.1.1/24"
        ]
      },
      {
        "uuid": "lrp-core-c",
        "name": "rtos-net-c",
        "mac": "0a:58:0a:f4:02:01",
        "networks": [
          "10.244.2.1/24"
        ]
      }
    ],
    "logicalSwitches": [
      {
        "uuid": "ls-a",
        "name": "net-a",
        "ports": [
          "lsp-a1",
          "lsp-a2",
          "lsp-a-router"
        ],
        "otherConfig": {
          "subnet": "10.244.0.0/24"
        }
      },
      {
        "uuid": "ls-b",
        "name": "net-b",
        "ports": [
          "lsp-b1",
          "lsp-b2",
          "lsp-b-router"
        ],
        "otherConfig": {
          "subnet": "10.244.1.0/24"
        }
      },
      {
        "uuid": "ls-c",
        "name": "net-c",
        "ports": [
          "lsp-c1",
          "lsp-c2",
          "lsp-c-router"
        ],
        "otherConfig": {
          "subnet": "10.244.2.0/24"
        }
      }
    ],
    "logicalSwitchPorts": [
      {
        "uuid": "lsp-a1",
        "name": "a1",
        "addresses": [
          "0a:58:0a:f4:00:05 10.244.0.5"
        ]
      },
      {
        "uuid": "lsp-a2",
        "name": "a2",
        "addresses": [
          "0a:58:0a:f4:00:06 10.244.0.6"
        ]
      },
      {
        "uuid": "lsp-a-router",
        "name": "stor-net-a",
        "type": "router",
        "addresses": [
          "router"
        ],
        "options": {
          "router-port": "rtos-net-a"
        }
      },
      {
        "uuid": "lsp-b1",
        "name": "b1",
        "addresses": [
          "0a:58:0a:f4:01:05 10.244.1.5"
        ]
      },
      {
        "uuid": "lsp-b2",
        "name": "b2",
        "addresses": [
          "0a:58:0a:f4:01:06 10.244.1.6"
        ]
      },
      {
        "uuid": "lsp-b-router",
        "name": "stor-net-b",
        "type": "router",
        "addresses": [
          "router"
        ],
        "options": {
          "router-port": "rtos-net-b"
        }
      },
      {
        "uuid": "lsp-c1",
        "name": "c1",
        "addresses": [
          "0a:58:0a:f4:02:05 10.244.2.5"
        ]
      },
      {
        "uuid": "lsp-c2",
        "name": "c2",
        "addresses": [
          "0a:58:0a:f4:02:06 10.244.2.6"
        ]
      },
      {
        "uuid": "lsp-c-router",
        "name": "stor-net-c",
        "type": "router",
        "addresses": [
          "router"
        ],
        "options": {
          "router-port": "rtos-net-c"
        }
      }
    ],
    "nats": [],
    "staticRoutes": []
  },
  "nodes": [
    {
      "id": "lr-core",
      "kind": "logical_router",
      "label": "core"
    },
    {
      "id": "ls-a",
      "kind": "logical_switch",
      "label": "net-a"
    },
    {
      "id": "ls-b",
      "kind": "logical_switch",
      "label": "net-b"
    },
    {
      "id": "ls-c",
      "kind": "logical_switch",
      "label": "net-c"
    },
    {
      "id": "lsp-a1",
      "kind": "logical_switch_port",
      "label": "a1"
    },
    {
      "id": "lsp-a2",
      "kind": "logical_switch_port",
      "label": "a2"
    },
    {
      "id": "lsp-b1",
      "kind": "logical_switch_port",
      "label": "b1"
    },
    {
      "id": "lsp-b2",
      "kind": "logical_switch_port",
      "label": "b2"
    },
    {
      "id": "lsp-c1",
      "kind": "logical_switch_port",
      "label": "c1"
    },
    {
      "id": "lsp-c2",
      "kind": "logical_switch_port",
      "label": "c2"
    }
  ],
  "edges": [
    {
      "id": "e-a",
      "source": "lr-core",
      "target": "ls-a",
      "kind": "router_to_switch"
    },
    {
      "id": "e-b",
      "source": "lr-core",
      "target": "ls-b",
      "kind": "router_to_switch"
    },
    {
      "id": "e-c",
      "source": "lr-core",
      "target": "ls-c",
      "kind": "router_to_switch"
    },
    {
      "id": "e-a1",
      "source": "ls-a",
      "target": "lsp-a1",
      "kind": "switch_to_port"
    },
    {
      "id": "e-a2",
      "source": "ls-a",
      "target": "lsp-a2",
      "kind": "switch_to_port"
    },
    {
      "id": "e-b1",
      "source": "ls-b",
      "target": "lsp-b1",
      "kind": "switch_to_port"
    },
    {
      "id": "e-b2",
      "source": "ls-b",
      "target": "lsp-b2",
      "kind": "switch_to_port"
    },
    {
      "id": "e-c1",
      "source": "ls-c",
      "target": "lsp-c1",
      "kind": "switch_to_port"
    },
    {
      "id": "e-c2",
      "source": "ls-c",
      "target": "lsp-c2",
      "kind": "switch_to_port"
    }
  ],
  "groups": [
    {
      "id": "g-a",
      "label": "A",
      "nodeIds": [
        "ls-a",
        "lsp-a1",
        "lsp-a2"
      ]
    },
    {
      "id": "g-b",
      "label": "B",
      "nodeIds": [
        "ls-b",
        "lsp-b1",
        "lsp-b2"
      ]
    },
    {
      "id": "g-c",
      "label": "C",
      "nodeIds": [
        "ls-c",
        "lsp-c1",
        "lsp-c2"
      ]
    }
  ],
  "warnings": []
}
