{
  "metadata": {
    "schemaVersion": "2",
    "generatedAt": "2026-01-01T00:00:00Z",
    "sourceHealth": "degraded",
    "nodeName": ""
  },
  "database": {
    "logicalRouters": [],
    "logicalRouterPorts": [],
    "logicalSwitches": [],
    "logicalSwitchPorts": [],
    "nats": [],
    "staticRoutes": []
  },
  "nodes": [],
  "edges": [],
  "groups": [],
  "warnings": [
    {
      "code": "SNAPSHOT_DEFAULT",
      "message": "No node-specific snapshot found; returning default payload"
    }
  ]
}
