{
  "metadata": {
    "schemaVersion": "2",
    "generatedAt": "2026-01-01T00:15:00Z",
    "sourceHealth": "degraded",
    "nodeName": "worker-parse-edge"
  },
  "database": {
    "logicalRouters": [
      {
        "uuid": "lr-edge",
        "name": "edge-router",
        "ports": [
          "lrp-edge"
        ]
      }
    ],
    "logicalRouterPorts": [
      {
        "uuid": "lrp-edge",
        "name": "rtos-edge-net",
        "mac": "0a:58:0a:f5:00:01",
        "networks": [
          "10.245.0.1/24"
        ]
      }
    ],
    "logicalSwitches": [
      {
        "uuid": "ls-edge",
        "name": "edge-net",
        "ports": [
          "lsp-edge-router"
        ]
      }
    ],
    "logicalSwitchPorts": [
      {
        "uuid": "lsp-edge-router",
        "name": "stor-edge-net",
        "type": "router",
        "addresses": [
          "router"
        ],
        "options": {
          "router-port": "rtos-edge-net"
        }
      }
    ],
    "nats": [],
    "staticRoutes": []
  },
  "nodes": [
    {
      "id": "lr-edge",
      "kind": "logical_router",
      "label": "edge-router"
    },
    {
      "id": "ls-edge",
      "kind": "logical_switch",
      "label": "edge-net"
    }
  ],
  "edges": [
    {
      "id": "e-edge",
      "source": "lr-edge",
      "target": "ls-edge",
      "kind": "router_to_switch",
      "data": {
        "rawFieldRecovered": true,
        "normalizationPath": "single_quote_fix"
      }
    }
  ],
  "groups": [],
  "warnings": [
    {
      "code": "PARSER_NORMALIZED",
      "message": "Input required normalization due to inconsistent OVN command output"
    }
  ]
}
